{
  "id": "scala-marrone",
  "title": "La scala marrone",
  "area": "sensoriale",
  "skill": "dimensioni",
  "type": "sequence",
  "ageBands": [
    "3-5",
    "6-7"
  ],
  "offscreen": "Con libri di spessore diverso: dal più grosso al più sottile, in fila come una scala.",
  "levels": [
    {
      "rounds": [
        {
          "prompt": "Dal più grosso al più sottile",
          "sizes": true,
          "cards": [
            {
              "emoji": "🟫",
              "size": 1.0
            },
            {
              "emoji": "🟫",
              "size": 0.7
            },
            {
              "emoji": "🟫",
              "size": 0.4
            }
          ]
        }
      ]
    },
    {
      "rounds": [
        {
          "prompt": "Dal più grosso al più sottile",
          "sizes": true,
          "cards": [
            {
              "emoji": "🟫",
              "size": 1.0
            },
            {
              "emoji": "🟫",
              "size": 0.85
            },
            {
              "emoji": "🟫",
              "size": 0.7
            },
            {
              "emoji": "🟫",
              "size": 0.55
            },
            {
              "emoji": "🟫",
              "size": 0.4
            },
            {
              "emoji": "🟫",
              "size": 0.25
            }
          ]
        }
      ]
    }
  ],
  "version": 1,
  "module": "montessori",
  "intro": {
    "bo": "Proviamo insieme, {nome}? Se sbagliamo, il materiale ce lo dice da solo.",
    "pilu": "Guarda bene, {nome}: qui non serve che io ti dica se è giusto. Lo vedi tu.",
    "tango": "Dai {nome}! Qui si può sbagliare quanto vuoi: si vede subito e si riprova."
  },
  "outro": {
    "bo": "Ce l'abbiamo fatta, {nome}. Questa, se vuoi, si fa anche con le cose vere.",
    "pilu": "Bravo {nome}. La stessa cosa esiste con oggetti veri: chiedi a un grande.",
    "tango": "Fatto! {nome}, domani la facciamo con le cose vere? Io porto le zampe."
  },
  "togetherSuggested": false
}
