{
  "id": "numeri-e-quantita",
  "title": "Numeri e quantità",
  "area": "matematica",
  "skill": "numeri",
  "type": "pairs",
  "ageBands": [
    "3-5",
    "6-7"
  ],
  "offscreen": "I fuselli: dieci scomparti numerati da 0 a 9, e stecchini da mettere dentro contando ad alta voce.",
  "levels": [
    {
      "rounds": [
        {
          "prompt": "Abbina il numero alla quantità",
          "pairs": [
            [
              "1",
              "●"
            ],
            [
              "2",
              "●●"
            ],
            [
              "3",
              "●●●"
            ]
          ],
          "wordPairs": true
        }
      ]
    },
    {
      "rounds": [
        {
          "prompt": "Abbina il numero alla quantità",
          "pairs": [
            [
              "4",
              "●●●●"
            ],
            [
              "5",
              "●●●●●"
            ],
            [
              "6",
              "●●●●●●"
            ],
            [
              "7",
              "●●●●●●●"
            ],
            [
              "8",
              "●●●●●●●●"
            ]
          ],
          "wordPairs": true
        }
      ]
    },
    {
      "rounds": [
        {
          "prompt": "Abbina il numero alla quantità",
          "pairs": [
            [
              "10",
              "●●●●●●●●●●"
            ],
            [
              "12",
              "●●●●●●●●●● ●●"
            ],
            [
              "15",
              "●●●●●●●●●● ●●●●●"
            ],
            [
              "20",
              "●●●●●●●●●● ●●●●●●●●●●"
            ]
          ],
          "wordPairs": true
        }
      ]
    }
  ],
  "version": 1,
  "module": "montessori",
  "intro": {
    "bo": "Proviamo insieme, {nome}? Se sbagliamo, il materiale ce lo dice da solo.",
    "pilu": "Guarda bene, {nome}: qui non serve che io ti dica se è giusto. Lo vedi tu.",
    "tango": "Dai {nome}! Qui si può sbagliare quanto vuoi: si vede subito e si riprova."
  },
  "outro": {
    "bo": "Ce l'abbiamo fatta, {nome}. Questa, se vuoi, si fa anche con le cose vere.",
    "pilu": "Bravo {nome}. La stessa cosa esiste con oggetti veri: chiedi a un grande.",
    "tango": "Fatto! {nome}, domani la facciamo con le cose vere? Io porto le zampe."
  },
  "togetherSuggested": false
}
