{
  "id": "caccia-superfici",
  "title": "Caccia alle superfici",
  "area": "sensoriale",
  "skill": "superfici",
  "type": "hunt",
  "ageBands": [
    "3-5",
    "6-7"
  ],
  "intro": {
    "bo": "{nome}, facciamo una caccia al tesoro? Tu cerchi, io ti aspetto qui. Una cosa alla volta.",
    "pilu": "{nome}, ti dico una cosa da cercare. Guarda bene intorno a te: i tesori sono dappertutto.",
    "tango": "Caccia al tesoro, {nome}! Vengo anch'io! ...No, io resto qui. Tu cerca, piano."
  },
  "outro": {
    "bo": "Quanti tesori, {nome}. Adesso ognuno torna al suo posto, così domani li ritroviamo.",
    "pilu": "Ogni tesoro torna dove l'hai trovato, {nome}: anche questo fa parte del gioco.",
    "tango": "Che caccia! {nome}, rimettiamo tutto a posto? Io... io controllo."
  },
  "togetherSuggested": false,
  "offscreen": "Passate la mano insieme su tre superfici diverse (il tavolo, un maglione, il vetro) e trovate una parola per ciascuna.",
  "levels": [
    {
      "items": [
        {
          "emoji": "🪟",
          "label": "Una superficie liscia",
          "say": "Cerca una superficie liscia e passaci sopra la mano. Poi dimmi com'è."
        },
        {
          "emoji": "🧶",
          "label": "Una superficie ruvida",
          "say": "Adesso una superficie ruvida, che sotto la mano gratta."
        },
        {
          "emoji": "🛋️",
          "label": "Una superficie morbida",
          "say": "E una superficie morbida, dove la mano affonda un po'."
        }
      ]
    },
    {
      "items": [
        {
          "emoji": "🌡️",
          "label": "Una superficie fredda",
          "say": "Cerca una superficie fredda, come il vetro o una piastrella."
        },
        {
          "emoji": "🧱",
          "label": "Una superficie con i rilievi",
          "say": "Adesso una superficie con dei rilievi o delle righe. Senti con i polpastrelli."
        },
        {
          "emoji": "📃",
          "label": "Una superficie che fa rumore",
          "say": "E una superficie che fa rumore quando la accarezzi piano."
        },
        {
          "emoji": "🪵",
          "label": "Due superfici diverse vicine",
          "say": "Per finire, due superfici diverse una accanto all'altra. Dimmi in cosa sono diverse."
        }
      ]
    }
  ],
  "version": 1,
  "module": "montessori"
}
